{
  "allowed_effects": [],
  "case_ids": [
    "case.benchmark.tabular-classification.centered",
    "case.benchmark.tabular-classification.low-boundary",
    "case.benchmark.tabular-classification.shifted",
    "case.benchmark.tabular-classification.holdout-case"
  ],
  "constraints": [
    {
      "description": "A route is eligible only when the independent oracle accepts it.",
      "id": "constraint.acceptance",
      "operator": "eq",
      "target": "verification.accepted",
      "unit": "",
      "value": true
    }
  ],
  "extensions": {
    "benchmark.claim-scope": "mechanism-fixture"
  },
  "external_requirements": [
    "These bundled synthetic cases prove framework mechanics; replace them with representative, licensed development and hidden holdout data before making production or domain-performance claims."
  ],
  "granted_permissions": [],
  "id": "task.benchmark.tabular-classification",
  "inputs": [
    {
      "cardinality": "one",
      "description": "Task input dataset.",
      "name": "dataset",
      "type": {
        "id": "example.classification-dataset",
        "media_type": "application/json",
        "schema_digest": "",
        "units": "",
        "version": "1"
      }
    }
  ],
  "intent": "Split labeled tabular data, fit a classifier, and measure holdout behavior.",
  "objectives": [
    {
      "direction": "maximize",
      "hard_maximum": null,
      "hard_minimum": null,
      "metric": "quality",
      "weight": 1.0
    },
    {
      "direction": "minimize",
      "hard_maximum": null,
      "hard_minimum": null,
      "metric": "latency_ms",
      "weight": 1.0
    }
  ],
  "oracle": {
    "candidate_readable": true,
    "description": "Bundled deterministic acceptance oracle. It is separate from node implementations but readable because these are transparent fixtures.",
    "evaluator_digest": "sha256:bcadf86712c7696cc798c1adb8fa942071f00fa4758f390ebac92c5200f43d39",
    "id": "verifier.example.classification",
    "implementation_ref": "python://solutiongraph.examples.tasks:_classification_verifier",
    "independence": "separate-implementation",
    "kind": "property",
    "version": "1.0.0"
  },
  "outputs": [
    {
      "cardinality": "one",
      "description": "Task output result.",
      "name": "result",
      "type": {
        "id": "example.classification-result",
        "media_type": "application/json",
        "schema_digest": "",
        "units": "",
        "version": "1"
      }
    }
  ],
  "success_contract": "An independent verifier accepts accuracy above the declared limit.",
  "tags": [
    "benchmark.synthetic",
    "domain.ml",
    "task.classification"
  ],
  "task_model_version": "0.1",
  "title": "Data science classification",
  "version": "1.0.0"
}
